,Nome,CGC,Endereco
0,"ALUMINIO, SP",4841-0,"rua rio grande do sul num 637 - aluminio 181250 - aluminio, sp ag. numero: 4841-0"
1,"JUSTICA FEDERAL AMERICANA, SP",2156-3,"avenida de cillo num 1600 - cidade jardim 13466550 - americana, sp ag. numero: 2156-3"
2,"AGRO ARACATUBA, SP",4485-7,"avenida brasilia num 1867 - jardim nova yorque 160180 - aracatuba, sp ag. numero: 4485-7"
3,"CIDADE DOS ARACAS, SP",3302-2,"avenida do fico num 410 - sao joaquim 16050387 - aracatuba, sp ag. numero: 3302-2"
4,"JUSTICA DO TRABALHO ARACATUBA, SP",2397-3,"rua duque de caxias num 2130 - saudade 16020225 - aracatuba, sp ag. numero: 2397-3"
5,"JUSTICA FEDERAL ARACATUBA, SP",3971-3,"avenida joaquim pompeu de toledo num 1534 - vila estadio 1602050 - aracatuba, sp ag. numero: 3971-3"
6,"JUSTICA FEDERAL ARARAQUARA, SP",2683-2,"avenida padre francisco sales colturato num 658 - centro 148020 - araraquara, sp ag. numero: 2683-2"
7,"SAO BENTO DE ARARAQUARA, SP",2100-8,"rua 9 de julho num 1724 - centro 14801295 - araraquara, sp ag. numero: 2100-8"
8,"CIDADE DAS ARVORES, SP",0837-0,"rua tiradentes num 60 - centro 1360070 - araras, sp ag. numero: 0837-0"
9,"AGRO ASSIS, SP",7984-7,"avenida rui barbosa num 1506 - centro 198140 - assis, sp ag. numero: 7984-7"
10,"JUSTICA DO TRABALHO ASSIS, SP",2790-1,"rua walter antonio fontana num 625 - vila claudia 19815340 - assis, sp ag. numero: 2790-1"
11,"JUSTICA FEDERAL ASSIS, SP",4101-7,"rua vinte e quatro de maio num 265 - centro 1980030 - assis, sp ag. numero: 4101-7"
12,"JUIZADO ESPECIAL FEDERAL AVARE, SP",3110-0,"largo sao joao num 60 - centro 18700210 - avare, sp ag. numero: 3110-0"
13,"PLATAFORMA EMPRESAS ALPHAVILLE, SP",7361-0,"alameda araguaia num 240 - alphaville industrial 64550 - barueri, sp ag. numero: 7361-0"
14,"VINTE E SEIS DE MARCO, SP",1891-0,"avenida vinte e seis de marco num 445 - centro 640150 - barueri, sp ag. numero: 1891-0"
15,AG EMPRESARIAL CENTRO OESTE PTA,3090-2,"avenida getulio vargas quadra q 20-105 - parque jardim europa 17017383 - bauru, sp ag. numero: 3090-2"
16,"AGRO BAURU, SP",7483-7,"avenida getulio vargas num 21 e 51 - parque jardim europa 17017383 - bauru, sp ag. numero: 7483-7"
17,"AVENIDA DUQUE, SP",2989-0,"avenida duque de caxias quadra q 18-75 - vila cardia 1701166 - bauru, sp ag. numero: 2989-0"
18,"DIGITAL VITORIA REGIA, SP",5193-4,"avenida getulio vargas quadra q 20-105 - parque jardim europa 17017383 - bauru, sp ag. numero: 5193-4"
19,"JUSTICA FEDERAL BAURU, SP",3965-9,"rua gustavo maciel q 7-33 - centro 17010180 - bauru, sp ag. numero: 3965-9"
20,"PLAT DIG BAURU, SP",3758-3,"avenida getulio vargas quadra q 20-105 - parque jardim europa 17017383 - bauru, sp ag. numero: 3758-3"
21,"PLATAFORMA EMPRESAS BAURU, SP",6398-3,"avenida getulio vargas quadra q 20/105 - parque jardim europa 17017383 - bauru, sp ag. numero: 6398-3"
22,"VISTA ALEGRE, SP",4207-2,"avenida nacoes unidas q 27-72 - vila nova cidade universitaria 17012202 - bauru, sp ag. numero: 4207-2"
23,"MAITINGA, SP",2179-2,"avenida anchieta num 3005 - maitinga 11251175 - bertioga, sp ag. numero: 2179-2"
24,"JEF BOTUCATU, SP",3109-7,"avenida doutor vital brasil num 820 - vila sao lucio 18603193 - botucatu, sp ag. numero: 3109-7"
25,"JF BRAGANCA PAULISTA, SP",2746-4,"avenida dos imigrantes num 1411 - jardim america 129020 - braganca paulista, sp ag. numero: 2746-4"
26,"CACONDE, SP",2082-6,"rua nicolau fanuelli num 115 - centro 137700 - caconde, sp ag. numero: 2082-6"
27,AG EMPRESARIAL CAMPINAS,3094-5,"rua barao de jaguara num 1511 - centro 130152 - campinas, sp ag. numero: 3094-5"
28,CORPORATIVO AGRO SUDESTE,4672-8,"rua barao de jaguara num 1511 - centro 130151 - campinas, sp ag. numero: 4672-8"
29,CORPORATIVO INTERIOR SP,4272-2,"rua barao de jaguara num 1511 - centro 130152 - campinas, sp ag. numero: 4272-2"
30,"DIGITAL CIDADE ORQUIDEIRA, SP",5735-5,"rua barao de jaguara num 1511 - centro 130152 - campinas, sp ag. numero: 5735-5"
31,"DIGITAL METROPOLITANA CAMPINAS, SP",5996-0,"rua barao de jaguara num 1511 - centro 130152 - campinas, sp ag. numero: 5996-0"
32,"DIGITAL NOVA CAMPINAS, SP",2620-4,"rua barao de jaguara num 1511 - centro 130152 - campinas, sp ag. numero: 2620-4"
33,"JUSTICA FEDERAL CAMPINAS, SP",2554-2,"avenida aquidaban num 459 - bosque 13015210 - campinas, sp ag. numero: 2554-2"
34,"PARQUE PRADO, SP",1160-6,"avenida washington luis num 2300 - vila marieta 13042105 - campinas, sp ag. numero: 1160-6"
35,"PLAT DIG CAMPINAS, SP",3720-6,"rua barao de jaguara num 1511 - centro 130152 - campinas, sp ag. numero: 3720-6"
36,"PLAT DIG ESTACAO CULTURA, SP",5693-6,"rua barao de jaguara num 1194 - centro 130152 - campinas, sp ag. numero: 5693-6"
37,"PLATAFORMA EMPRESAS ANDORINHAS, SP",7457-8,"avenida francisco glicerio num 1480 - centro 13012100 - campinas, sp ag. numero: 7457-8"
38,"PLATAFORMA EMPRESAS LAG TAQUARAL,SP",6055-0,"avenida da saudade num 805 - ponte preta 13041670 - campinas, sp ag. numero: 6055-0"
39,PRIVATE SAO PAULO INTERIOR,4864-0,"rua barao de jaguara num 1511 - centro 130152 - campinas, sp ag. numero: 4864-0"
40,"SANASA CAMPINAS, SP",2722-7,"rua padre joao garcia num 10 - ponte preta 13041630 - campinas, sp ag. numero: 2722-7"
41,"TRT CAMPINAS, SP",4057-6,"rua barao de jaguara num 901 - centro 130151 - campinas, sp ag. numero: 4057-6"
42,"LITORAL PAULISTA NORTE, SP",4768-6,"avenida jose herculano num 1086 - pontal de santa marina 11672901 - caraguatatuba, sp ag. numero: 4768-6"
43,"14 DE ABRIL, SP",1798-1,"praca da republica num 05 - centro 15800105 - catanduva, sp ag. numero: 1798-1"
44,"JUSTICA DO TRABALHO CATANDUVA, SP",7666-0,"rua recife num 585 - centro 15800240 - catanduva, sp ag. numero: 7666-0"
45,"DUARTINA, SP",4320-6,"avenida sao paulo num 252 - centro 174700 - duartina, sp ag. numero: 4320-6"
46,"JUSTICA FEDERAL FRANCA, SP",3995-0,"avenida presidente vargas num 543 - cidade nova 14401110 - franca, sp ag. numero: 3995-0"
47,"PLATAFORMA EMPRESAS FRANCA, SP",7437-3,"rua monsenhor rosa num 1639 - centro 14400670 - franca, sp ag. numero: 7437-3"
48,"VILA APARECIDA, SP",4237-4,"avenida brasil num 1920 - vila aparecida 14401240 - franca, sp ag. numero: 4237-4"
49,"JUSTICA FEDERAL GUARATINGUETA, SP",4107-6,"rua joao pessoa num 58 - pedregulho 1251510 - guaratingueta, sp ag. numero: 4107-6"
50,"PRAIA DA ENSEADA, SP",4574-8,"avenida leomil num 631 - centro 11410161 - guaruja, sp ag. numero: 4574-8"
51,"DIGITAL GUARULHOS, SP",2671-9,"avenida emilio ribas num 1491 - jardim tranquilidade 70510 - guarulhos, sp ag. numero: 2671-9"
52,"JUSTICA FEDERAL GUARULHOS, SP",4042-8,"avenida salgado filho num 2050 - cidade maia 71150 - guarulhos, sp ag. numero: 4042-8"
53,"NOVA SETE DE SETEMBRO, SP",0223-2,"rua sete de setembro num 134 - centro 701120 - guarulhos, sp ag. numero: 0223-2"
54,"PICANCO, SP",4529-2,"rua cachoeira num 461 - jardim rosa de franca 70800 - guarulhos, sp ag. numero: 4529-2"
55,"PLATAFORMA EMPRESAS GUARULHOS, SP",7039-4,"avenida salgado filho num 100 - centro 71150 - guarulhos, sp ag. numero: 7039-4"
56,"PONTE GRANDE, SP",7553-1,"avenida guarulhos num 3820 - ponte grande 70301 - guarulhos, sp ag. numero: 7553-1"
57,"LITORAL PAULISTA SUL, SP",4795-3,"rua expedicionario poitena num 58 - centro 117400 - itanhaem, sp ag. numero: 4795-3"
58,"AGRO ITAPEVA, SP",7549-3,"rua pires fleury num 149 - centro 18400430 - itapeva, sp ag. numero: 7549-3"
59,"ITAQUA SHOPPING, SP",0869-9,"estrada municip do mandi num 1205 - jardim adriane 85960 - itaquaquecetuba, sp ag. numero: 0869-9"
60,"PRINCESA DA COLINA, SP",2037-0,"praca da bandeira num 51 - centro 13250329 - itatiba, sp ag. numero: 2037-0"
61,"JUSTICA FEDERAL JAU, SP",2742-1,"rua edgard ferraz num 449 - centro 17201440 - jau, sp ag. numero: 2742-1"
62,"JOANOPOLIS, SP",3400-2,"largo sao joao num 166 - centro 129800 - joanopolis, sp ag. numero: 3400-2"
63,AG EMPRESARIAL SUDESTE PAULISTA,3104-6,"avenida nove de julho num 3775 - anhangabau 1320856 - jundiai, sp ag. numero: 3104-6"
64,"DIGITAL JUNDIAI, SP",7165-0,"rua das pitangueiras num 535 - jardim pitangueiras ii 13206716 - jundiai, sp ag. numero: 7165-0"
65,"PLATAFORMA EMPRESAS JUNDIAI, SP",7453-5,"rua rangel pestana num 278/286 - centro 132010 - jundiai, sp ag. numero: 7453-5"
66,"SERRA DO JAPI, SP",2968-8,"avenida nove de julho num 3775 - anhangabau 1320856 - jundiai, sp ag. numero: 2968-8"
67,"CIDADE DO ALGODAO, SP",4821-6,"rua general osorio num 357 - centro 1361050 - leme, sp ag. numero: 4821-6"
68,"JT LIMEIRA, SP",7931-6,"rua henrique jacobs num 2040 - parque campos eliseos 13485321 - limeira, sp ag. numero: 7931-6"
69,"AV TIRADENTES, SP",4113-0,"avenida rio branco num 651 - alto cafezal 175020 - marilia, sp ag. numero: 4113-0"
70,"JUSTICA DO TRABALHO MARILIA, SP",3297-2,"avenida tiradentes num 580 - fragata 17501330 - marilia, sp ag. numero: 3297-2"
71,"JUSTICA FEDERAL MARILIA, SP",3972-1,"rua amazonas num 527 - centro 17509120 - marilia, sp ag. numero: 3972-1"
72,"JUSTICA DO TRABALHO MATAO, SP",7665-1,"rua jundiai num 1270 - nova matao 15990510 - matao, sp ag. numero: 7665-1"
73,"PREFEITURA MUNICIPAL DE MAUA, SP",2113-0,"avenida governador mario covas junior num 1 - centro 939040 - maua, sp ag. numero: 2113-0"
74,"JEF MOGI DAS CRUZES, SP",3096-1,"avenida fernando costa num 820 - centro 87350 - mogi das cruzes, sp ag. numero: 3096-1"
75,"PLATAFORMA EMPRESAS ALTO TIETE, SP",5501-8,"rua dom antonio candido de alvarenga num 257 - centro 878070 - mogi das cruzes, sp ag. numero: 5501-8"
76,"DIGITAL OSASCO, SP",2674-3,"avenida doutor martin luther king num 726 - umuarama 60303 - osasco, sp ag. numero: 2674-3"
77,"JUSTICA FEDERAL OSASCO, SP",3034-1,"rua avelino lopes num 281/291 - centro 609035 - osasco, sp ag. numero: 3034-1"
78,"MUTINGA, SP",3356-1,"avenida cruzeiro do sul num 1099 - rochdale 62266 - osasco, sp ag. numero: 3356-1"
79,"PLATAFORMA EMPRESAS OSASCO, SP",7507-8,"avenida dos autonomistas num 2423 - centro 609020 - osasco, sp ag. numero: 7507-8"
80,"TECNOLOGIA SAO PAULO, SP",2721-9,"avenida doutor martin luther king num 762 - jardim santo antoninho 60303 - osasco, sp ag. numero: 2721-9"
81,"VILA YARA, SP",2920-3,"avenida dos autonomistas num 197 - vila sao jose 60200 - osasco, sp ag. numero: 2920-3"
82,"EXPEDICIONARIOS, SP",2988-2,"rua do expedicionario num 655 - centro 1990041 - ourinhos, sp ag. numero: 2988-2"
83,"JUSTICA DO TRABALHO OURINHOS, SP",1408-7,"rua paulo sa num 565 - vila moraes 19900221 - ourinhos, sp ag. numero: 1408-7"
84,"JUSTICA FEDERAL OURINHOS, SP",2874-6,"avenida conselheiro rodrigues alves num 365 - vila sa 19907270 - ourinhos, sp ag. numero: 2874-6"
85,AG EMPRESARIAL PIRACICABA,4281-1,"avenida independencia num 3415 - alemaes 13416240 - piracicaba, sp ag. numero: 4281-1"
86,"DIGITAL PIRACICABANA, SP",2632-8,"avenida independencia num 3415 - vila independencia 13416240 - piracicaba, sp ag. numero: 2632-8"
87,"JUSTICA DO TRABALHO PIRACICABA, SP",1397-8,"rua sao jose num 667 - centro 13400330 - piracicaba, sp ag. numero: 1397-8"
88,"JUSTICA FEDERAL PIRACICABA, SP",3969-1,"avenida mario dedine num 234 - vila rezende 13405270 - piracicaba, sp ag. numero: 3969-1"
89,"NOIVA DA COLINA, SP",3428-2,"avenida independencia num 3415 - alemaes 13416240 - piracicaba, sp ag. numero: 3428-2"
90,"PLAT DIG PIRACICABA, SP",3870-9,"avenida independencia num 3415 - alemaes 13416240 - piracicaba, sp ag. numero: 3870-9"
91,"PLATAFORMA EMPRESAS PIRACICABA, SP",6425-4,"avenida independencia num 3415 - vila independencia 13416240 - piracicaba, sp ag. numero: 6425-4"
92,"RUA MORAES BARROS, SP",4889-5,"rua sao jose num 667 - centro 13400330 - piracicaba, sp ag. numero: 4889-5"
93,"PREF MUN PIRAPORA DO BOM JESUS, SP",3399-5,"praca poderes municipais num 57 - centro 65500 - pirapora do bom jesus, sp ag. numero: 3399-5"
94,"PLATAFORMA EMPRESAS PRAIA GRANDE,SP",6362-2,"avenida ayrton senna da silva num 1511 - sitio do campo 117260 - praia grande, sp ag. numero: 6362-2"
95,"AGRO PRESIDENTE PRUDENTE, SP",4605-1,"avenida coronel jose soares marcondes num 1199 - centro 1901081 - presidente prudente, sp ag. numero: 4605-1"
96,"DIGITAL ALTA PAULISTA, SP",3184-4,"avenida manoel goulart num 1120 - centro 19015240 - presidente prudente, sp ag. numero: 3184-4"
97,"JF PRESIDENTE PRUDENTE, SP",3967-5,"rua angelo rotta num 110 - jardim petropolis 19060420 - presidente prudente, sp ag. numero: 3967-5"
98,"JUST TRAB PRESIDENTE PRUDENTE, SP",2787-1,"avenida quatorze de setembro num 1080 - jardim paulistano 190140 - presidente prudente, sp ag. numero: 2787-1"
99,"OESTE PAULISTA, SP",4114-9,"avenida manoel goulart num 200 - vila nova 19010270 - presidente prudente, sp ag. numero: 4114-9"
100,"PREFEITURA MUNICIPAL RAFARD, SP",4950-6,"praca da independencia num 100 - centro 133700 - rafard, sp ag. numero: 4950-6"
101,"AG EMPRESARIAL ALTA MOGIANA, SP",4282-0,"avenida maurilio biagi num 800 - ribeirania 1409675 - ribeirao preto, sp ag. numero: 4282-0"
102,"AGRO RIBEIRAO PRETO, SP",4620-5,"rua alvares cabral num 930 - centro 1401080 - ribeirao preto, sp ag. numero: 4620-5"
103,"AV CASTELO BRANCO, SP",4488-1,"rua alice alem saadi num 855 - nova ribeirania 14096570 - ribeirao preto, sp ag. numero: 4488-1"
104,"AV MAURILIO BIAGI, SP",4710-4,"avenida portugal num 939 - jardim sao luiz 14020380 - ribeirao preto, sp ag. numero: 4710-4"
105,"BAIRRO VILA VIRGINIA, SP",4908-5,"rua doutor joao guiao num 790 - vila virginia 14030440 - ribeirao preto, sp ag. numero: 4908-5"
106,"DIGITAL RIBEIRAO PRETO SUL, SP",2657-3,"avenida nove de julho num 355 - centro 14010100 - ribeirao preto, sp ag. numero: 2657-3"
107,"JUST TRABALHO RIBEIRAO PRETO, SP",2681-6,"rua afonso taranto num 105 - nova ribeirania 14096740 - ribeirao preto, sp ag. numero: 2681-6"
108,"JUSTICA FEDERAL RIBEIRAO PRETO, SP",2014-1,"rua afonso taranto num 455 - nova ribeirania 14096740 - ribeirao preto, sp ag. numero: 2014-1"
109,"PLAT DIG RIBEIRAO PRETO, SP",3818-0,"avenida nove de julho num 355 - centro 14015170 - ribeirao preto, sp ag. numero: 3818-0"
110,"PLATAFORMA EMPRESAS ALTO FIUSA, SP",6385-1,"avenida professor joao fiusa num 2060 - jardim canada 14024260 - ribeirao preto, sp ag. numero: 6385-1"
111,"PLATAFORMA EMPRESAS RIB PRETO, SP",6403-3,"rua alvares cabral num 930 - centro 1401080 - ribeirao preto, sp ag. numero: 6403-3"
112,"RIO GRANDE DA SERRA, SP",3762-1,"avenida dom pedro i num 565 - centro 94500 - rio grande da serra, sp ag. numero: 3762-1"
113,"CENTRO HISTORICO, SP",4961-1,"largo sao bento num 30 - centro 650190 - santana de parnaiba, sp ag. numero: 4961-1"
114,"AMERICA DO SUL, SP",4986-7,"rua caucaso num 809 - parque novo oratorio 926010 - santo andre, sp ag. numero: 4986-7"
115,"DIGITAL GRANDE ABC, SP",2675-1,"rua carijos num 1665 - vila linda 91801 - santo andre, sp ag. numero: 2675-1"
116,"DIGITAL PAULISTANA, SP",2679-4,"avenida pereira barreto num 1286 - paraiso 9190210 - santo andre, sp ag. numero: 2679-4"
117,"JUSTICA FEDERAL SANTO ANDRE, SP",2791-0,"avenida pereira barreto num 1299 - paraiso 9190610 - santo andre, sp ag. numero: 2791-0"
118,"PLATAFORMA EMPRESAS SANTO ANDRE, SP",7634-1,"avenida industrial num 600 - jardim 9080500 - santo andre, sp ag. numero: 7634-1"
119,AG EMPRESARIAL BAIXADA SANTISTA,4277-3,"avenida ana costa num 433 - gonzaga 110600 - santos, sp ag. numero: 4277-3"
120,"AMADOR BUENO, SP",2963-7,"avenida conselheiro nebias num 701 - boqueirao 110453 - santos, sp ag. numero: 2963-7"
121,"DIGITAL BAIXADA SANTISTA, SP",2611-5,"avenida ana costa num 433 - gonzaga 110603 - santos, sp ag. numero: 2611-5"
122,"JUSTICA DO TRABALHO SANTOS, SP",2875-4,"rua braz cubas num 158 - vila nova 11013915 - santos, sp ag. numero: 2875-4"
123,"JUSTICA FEDERAL SANTOS, SP",2206-3,"praca barao do rio branco num 30 - centro 1101040 - santos, sp ag. numero: 2206-3"
124,"MARECHAL, SP",4360-5,"avenida ana costa num 194 - vila mathias 110600 - santos, sp ag. numero: 4360-5"
125,"PINHEIRO MACHADO, SP",3580-7,"avenida senador pinheiro machado num 824 - marape 110752 - santos, sp ag. numero: 3580-7"
126,"PLAT DIG LITORAL PAULISTA, SP",3471-1,"avenida ana costa num 222 - gonzaga 110602 - santos, sp ag. numero: 3471-1"
127,"PLATAFORMA EMPRESAS SANTOS, SP",6402-5,"avenida sao francisco num 164 - centro 11013200 - santos, sp ag. numero: 6402-5"
128,"AG EMPRESARIAL ABC, SP",4276-5,"rua jose versolato num 101/111 - centro 9750730 - sao bernardo do campo, sp ag. numero: 4276-5"
129,"CAMINHO DO MAR, SP",1878-3,"avenida caminho do mar num 2439 - vila mussolini 96090 - sao bernardo do campo, sp ag. numero: 1878-3"
130,"CAPITAO CASA, SP",0679-3,"avenida capitao casa num 1299 - dos casa 98120 - sao bernardo do campo, sp ag. numero: 0679-3"
131,"DIGITAL SAO BERNARDO, SP",2678-6,"avenida jose versolato num 111 - centro 9710190 - sao bernardo do campo, sp ag. numero: 2678-6"
132,"FERRAZOPOLIS, SP",4714-7,"rua marechal deodoro num 1605 - centro 9710190 - sao bernardo do campo, sp ag. numero: 4714-7"
133,"JF SAO BERNARDO DO CAMPO, SP",4027-4,"avenida senador vergueiro num 3595 - rudge ramos 96010 - sao bernardo do campo, sp ag. numero: 4027-4"
134,"METROPOLE, SP",4362-1,"avenida jose versolato num 111 - centro 9750730 - sao bernardo do campo, sp ag. numero: 4362-1"
135,"PLATAFORMA EMPRESAS SAO BERNARDO,SP",7682-1,"rua marechal deodoro num 1605 - centro 9710190 - sao bernardo do campo, sp ag. numero: 7682-1"
136,"PLATAFORMA EMPRESAS SAO CAETANO, SP",7062-9,"rua rio grande do sul num 436 - centro 951020 - sao caetano do sul, sp ag. numero: 7062-9"
137,"PROSPERIDADE, SP",2159-8,"avenida goias num 1780 - barcelona 955050 - sao caetano do sul, sp ag. numero: 2159-8"
138,"JUSTICA DO TRABALHO SAO CARLOS, SP",2944-0,"rua jose bonifacio num 888 - centro 13560610 - sao carlos, sp ag. numero: 2944-0"
139,"JUSTICA FEDERAL SAO CARLOS, SP",4102-5,"avenida teixeira de barros num 741 - vila prado 1357433 - sao carlos, sp ag. numero: 4102-5"
140,"AGRO SAO JOAO DA BOA VISTA, SP",7985-5,"praca coronel joaquim jose num 156 - centro 13870120 - sao joao da boa vista, sp ag. numero: 7985-5"
141,"JF SAO JOAO DA BOA VISTA, SP",2765-0,"rua getulio vargas num 21 - centro 13870100 - sao joao da boa vista, sp ag. numero: 2765-0"
142,AG EMPRESARIAL NOROESTE PAULISTA,4285-4,"rua bernardino de campos num 3960 - centro 15015300 - sao jose do rio preto, sp ag. numero: 4285-4"
143,"AGRO SAO JOSE DO RIO PRETO, SP",7986-3,"rua marechal deodoro da fonseca num 2739 - centro 1501070 - sao jose do rio preto, sp ag. numero: 7986-3"
144,"AV DANILO GALEAZZI, SP",4890-9,"avenida danilo galeazzi num 1493 - jardim santa rosa i 15050690 - sao jose do rio preto, sp ag. numero: 4890-9"
145,"DIGITAL RIO PRETO, SP",7191-9,"rua marechal deodoro da fonseca num 2739 - centro 1501070 - sao jose do rio preto, sp ag. numero: 7191-9"
146,"JF SAO JOSE DO RIO PRETO, SP",3970-5,"rua dos radialistas riopretenses num 1000 - chacara municipal 1509070 - sao jose do rio preto, sp ag. numero: 3970-5"
147,"JUSTICA TRABALHO S J RIO PRETO, SP",2760-0,"avenida jose munia num 5500 - chacara municipal 15090185 - sao jose do rio preto, sp ag. numero: 2760-0"
148,"PLATAFORMA EMPRESAS SJ RIO PRETO,SP",7360-1,"rua marechal deodoro da fonseca num 2739 - centro 1501070 - sao jose do rio preto, sp ag. numero: 7360-1"
149,AG EMPRESARIAL VALE DO PARAIBA,4293-5,"avenida cassiano ricardo num 521 - parque residencial aquarius 12246870 - sao jose dos campos, sp ag. numero: 4293-5"
150,"CTA SAO JOSE DOS CAMPOS, SP",1388-9,"praca marechal-do-ar eduardo gomes num 50 - campus do cta 12228615 - sao jose dos campos, sp ag. numero: 1388-9"
151,"DIGITAL VALE DO PARAIBA, SP",2614-0,"avenida doutor nelson d'avila num 40 - jardim sao dimas 1224531 - sao jose dos campos, sp ag. numero: 2614-0"
152,"JF SAO JOSE DOS CAMPOS, SP",2945-9,"rua doutor tertuliano delphim junior num 522 - jardim aquarius 122461 - sao jose dos campos, sp ag. numero: 2945-9"
153,"JUDICIARIO SAO JOSE DOS CAMPOS, SP",2730-8,"rua juiz david barrilli num 85 - pq res aquarius 12246200 - sao jose dos campos, sp ag. numero: 2730-8"
154,"PLATAFORMA EMPRESAS SJ CAMPOS, SP",7357-1,"avenida doutor nelson d'avila num 40 - jardim sao dimas 1224531 - sao jose dos campos, sp ag. numero: 7357-1"
155,AG EMPRESARIAL IPIRANGA,3103-8,"avenida doutor gentil de moura num 78 - ipiranga 42780 - sao paulo, sp ag. numero: 3103-8"
156,AG EMPRESARIAL PAULISTA,3154-2,"av paulista 750 num and 13 - bela vista 1310908 - sao paulo, sp ag. numero: 3154-2"
157,AG EMPRESARIAL PENHA,4278-1,"avenida amador bueno da veiga num 1151 - penha de franca 3635970 - sao paulo, sp ag. numero: 4278-1"
158,AG EMPRESARIAL SAO PAULO CENTRO SUL,4284-6,"avenida santo amaro num 7237 - granja julieta 4701200 - sao paulo, sp ag. numero: 4284-6"
159,AG EMPRESARIAL SAO PAULO LEST/NORTE,4283-8,"rua voluntarios da patria num 1512 - santana 2010300 - sao paulo, sp ag. numero: 4283-8"
160,AG EMPRESARIAL SAO PAULO OESTE,4280-3,"avenida pedroso de morais num 644 - pinheiros 54201 - sao paulo, sp ag. numero: 4280-3"
161,AG EMPRESARIAL SE,4286-2,"praca da republica num 309 - republica 10451 - sao paulo, sp ag. numero: 4286-2"
162,"ALVARES PENTEADO, SP",3039-2,"rua libero badaro num 509 - centro 10090 - sao paulo, sp ag. numero: 3039-2"
163,"AROUCHE, SP",1230-0,"praca da republica num 309 - republica 10451 - sao paulo, sp ag. numero: 1230-0"
164,"AV CELSO GARCIA, SP",4677-9,"avenida celso garcia num 151/157 - bras 30150 - sao paulo, sp ag. numero: 4677-9"
165,"AV JUSCELINO KUBITSCHEK, SP",3243-3,"avenida presidente juscelino kubitschek num 53 - vila nova conceicao 454310 - sao paulo, sp ag. numero: 3243-3"
166,"AVENIDA RANGEL PESTANA, SP",3775-3,"rua silva teles num 60 - pari 30260 - sao paulo, sp ag. numero: 3775-3"
167,"BIXIGA, SP",3149-6,"rua rui barbosa num 161/163 - bela vista 132610 - sao paulo, sp ag. numero: 3149-6"
168,"CEAGESP, SP",4740-6,"avenida doutor gastao vidigal num 1946 - vila leopoldina 5316900 - sao paulo, sp ag. numero: 4740-6"
169,"CET MARQUES DE SAO VICENTE, SP",0468-5,"avenida marques de sao vicente num 2154 - varzea da barra funda 11392 - sao paulo, sp ag. numero: 0468-5"
170,"CIDADE DUTRA, SP",4530-6,"avenida senador teotonio vilela num 852 - cidade dutra 48010 - sao paulo, sp ag. numero: 4530-6"
171,"CIDADE SAO PAULO, SP",3009-0,"rua pamplona num 518 - jardim paulista 14050 - sao paulo, sp ag. numero: 3009-0"
172,"CLODOMIRO AMAZONAS, SP",4636-1,"rua estados unidos num 1898 - jardim america 14272 - sao paulo, sp ag. numero: 4636-1"
173,CORPORATIVO CONSTRUCAO CIVIL,4992-1,"avenida av paulista 750 num 6 and - bela vista 1310908 - sao paulo, sp ag. numero: 4992-1"
174,CORPORATIVO INFRAESTRUTURA,3080-5,"avenida paulista num 750 - bela vista 1310100 - sao paulo, sp ag. numero: 3080-5"
175,CORPORATIVO SAO PAULO,3337-5,"avenida paulista num 750 - bela vista 1310100 - sao paulo, sp ag. numero: 3337-5"
176,"DIGITAL ALTO TIETE, SP",2669-7,"avenida amador bueno da veiga num 1151 - penha de franca 36350 - sao paulo, sp ag. numero: 2669-7"
177,"DIGITAL ANALIA FRANCO, SP",2676-0,"rua fernando falcao num 59/75 - vila claudia 31801 - sao paulo, sp ag. numero: 2676-0"
178,"DIGITAL ANHEMBI, SP",2673-5,"rua voluntarios da patria num 1512 - santana 2010300 - sao paulo, sp ag. numero: 2673-5"
179,"DIGITAL AV AMADOR BUENO, SP",2670-0,"avenida amador bueno da veiga num 1151 - penha de franca 36350 - sao paulo, sp ag. numero: 2670-0"
180,"DIGITAL AVENIDA PAULISTA, SP",3786-9,"avenida paulista num 750 - bela vista 1310908 - sao paulo, sp ag. numero: 3786-9"
181,"DIGITAL FARIA LIMA, SP",2672-7,"avenida voluntarios da patria num 1511 - santana 53140 - sao paulo, sp ag. numero: 2672-7"
182,"DIGITAL GRANJA JULIETA, SP",2677-8,"avenida santo amaro num 7237 - santo amaro 4701200 - sao paulo, sp ag. numero: 2677-8"
183,"DIGITAL IPIRANGA, SP",2826-6,"rua cincinato braga num 301/3029 - bela vista 133311 - sao paulo, sp ag. numero: 2826-6"
184,"DIGITAL ITAIM BIBI, SP",2667-0,"rua cincinato braga num 301/309 - bela vista 133311 - sao paulo, sp ag. numero: 2667-0"
185,"DIGITAL MUSEU CATAVENTO, SP",2666-2,"largo da concordia num 211 - bras 301210 - sao paulo, sp ag. numero: 2666-2"
186,"DIGITAL PRACA DA SE, SP",2665-4,"praca da se num 111 - se 10010 - sao paulo, sp ag. numero: 2665-4"
187,"EXECUCOES FISCAIS, SP",2527-5,"rua joao guimaraes rosa num 215 - centro 130330 - sao paulo, sp ag. numero: 2527-5"
188,"HEBRAICA, SP",2177-6,"avenida brigadeiro faria lima num 1644 - jardim america 14511 - sao paulo, sp ag. numero: 2177-6"
189,"JARDIM AEROPORTO, SP",1602-0,"avenida joao pedro cardoso num 375 - jardim aeroporto 43551 - sao paulo, sp ag. numero: 1602-0"
190,"JARDIM AVELINO, SP",4615-9,"avenida zelina num 694 - vila zelina 31430 - sao paulo, sp ag. numero: 4615-9"
191,"JARDIM GERMANIA, SP",2055-9,"estrada de itapecerica num 8629 - capao redondo 58583 - sao paulo, sp ag. numero: 2055-9"
192,"JEF SAO PAULO, SP",2766-9,"avenida paulista num 1345 - bela vista 1311200 - sao paulo, sp ag. numero: 2766-9"
193,"JUSTICA FEDERAL SAO PAULO, SP",0265-8,"avenida paulista num 1682 - bela vista 1310200 - sao paulo, sp ag. numero: 0265-8"
194,"LARGO DE PINHEIROS, SP",3328-6,"rua pais leme num 250 - pinheiros 542410 - sao paulo, sp ag. numero: 3328-6"
195,"LARGO SAO MATEUS, SP",2929-7,"avenida mateo bei num 1521/1525 - sao mateus 394911 - sao paulo, sp ag. numero: 2929-7"
196,"MOOCA PLAZA SHOPPING, SP",4851-8,"avenida capitao pacheco e chaves num 313 - vila prudente 31260 - sao paulo, sp ag. numero: 4851-8"
197,"NHAMBIQUARAS, SP",2189-0,"alameda dos maracatins num 634/636 - indianopolis 40891 - sao paulo, sp ag. numero: 2189-0"
198,"NOVA AUGUSTA, SP",3045-7,"rua augusta num 551 - consolacao 13050 - sao paulo, sp ag. numero: 3045-7"
199,"NOVA FIESTA, SP",4135-1,"avenida guarapiranga num 291 a - vila socorro 47620 - sao paulo, sp ag. numero: 4135-1"
200,"NOVA TIETE, SP",2880-0,"avenida maria candida num 177 - vila guilherme 207110 - sao paulo, sp ag. numero: 2880-0"
201,"PARQUE DO ESTADO, SP",4617-5,"avenida miguel stefano num 2029/2031 - saude 430112 - sao paulo, sp ag. numero: 4617-5"
202,"PATRIOTAS, SP",4616-7,"rua agostinho gomes num 1492 - ipiranga 42060 - sao paulo, sp ag. numero: 4616-7"
